{
  "$schema": "http://json-schema.org/draft-04/schema#",
  "type": "object",
  "properties": {
    "_links": {
      "type": "object",
      "properties": {
        "self": {
          "type": "object",
          "properties": {
            "href": {
              "type": "string"
            }
          },
          "required": [
            "href"
          ]
        },
        "accept": {
          "type": "object",
          "properties": {
            "href": {
              "type": "string"
            }
          },
          "required": [
            "href"
          ]
        },
        "reject": {
          "type": "object",
          "properties": {
            "href": {
              "type": "string"
            }
          },
          "required": [
            "href"
          ]
        }
      },
      "required": [
        "self",
        "accept",
        "reject"
      ]
    },
    "created": {
      "type": "string"
    },
    "lastUpdated": {
      "type": "string"
    },
    "arn": {
      "type": "string"
    },
    "regime": {
      "type": "string"
    },
    "clientId": {
      "type": "string"
    },
    "status": {
      "type": "string"
    }
  },
  "required": [
    "_links",
    "created",
    "lastUpdated",
    "arn",
    "regime",
    "clientId",
    "status"
  ]
}